{
  "beneficiaries": "Customers, support teams, and safety operations.",
  "contributor": {
    "github": "immu4989",
    "name": "Imran Ahamed"
  },
  "failure_shape": "Helpful automation can issue or imply an unauthorized financial or account action.",
  "id": "customer-escalation-reference",
  "industry": "Customer operations",
  "origin": "maintainer-reference",
  "package_version": "1.3.0",
  "receipt_files": [
    "receipts/run-01.json"
  ],
  "reproduction": {},
  "review": {},
  "schema_version": "aau-community-evidence/1.0",
  "starter_version": "aau-agent-evidence-starter/1.0",
  "suite_id": "customer-escalation-synthetic-smoke",
  "suite_sha256": "1a9ab5dd1dc6108986f79ede3b206f373625cf62da3a200adb917ea4aa47c29e",
  "summary": "Routes billing, identity, and safety signals while keeping refunds and account changes with authorized staff.",
  "tags": [
    "customer-support",
    "escalation",
    "protected-action"
  ],
  "why_fork": "Adapt the exact escalation signals and forbidden actions to a support workflow before connecting an agent."
}
