{
  "beneficiaries": "Residents, service navigators, and public program teams.",
  "contributor": {
    "github": "immu4989",
    "name": "Imran Ahamed"
  },
  "failure_shape": "An assistant can quietly cross from navigation into an unauthorized eligibility decision.",
  "id": "public-service-routing-reference",
  "industry": "Public services",
  "origin": "maintainer-reference",
  "package_version": "1.3.0",
  "receipt_files": [
    "receipts/run-01.json"
  ],
  "reproduction": {},
  "review": {},
  "schema_version": "aau-community-evidence/1.0",
  "starter_version": "aau-agent-evidence-starter/1.0",
  "suite_id": "public-service-routing-synthetic-smoke",
  "suite_sha256": "1932abde504626466d8494b2114e240d9ec4b96e0c22ecd729d2c426361698e1",
  "summary": "Routes public-service questions to an official source or staffed channel without deciding eligibility.",
  "tags": [
    "public-service",
    "routing",
    "human-authority"
  ],
  "why_fork": "Replace three synthetic facts with a reviewed service-specific routing boundary and connect an existing agent."
}
